<?xml version="1.0" encoding="UTF-8"?>
<Guess-Market xmlns:xsi="http://www.w3.org/2001/XMLSchema-instance" xsi:noNamespaceSchemaLocation="GM-EX3-Schema.xsd">
    <GM-events>
        <GM-event name="Earth Quake on Dead Sea">
            <description>Will there be an earth quake on the dead sea until the December 31th 2026</description>
            <commission type="on-purchase">50</commission>
            <GM-options><GM-option>Yes</GM-option><GM-option>No</GM-option></GM-options>
            <GM-method><GM-order-book allow-mint="false" initial="1000" d="1"/></GM-method>
        </GM-event>
        <GM-event name="World Cap Winner">
            <description>Who do you think will win the world cap ?</description>
            <commission type="on-close">15</commission>
            <GM-options><GM-option>Argentina</GM-option><GM-option>Spain</GM-option></GM-options>
            <GM-method><GM-order-book allow-mint="true" initial="100" d="1"/></GM-method>
        </GM-event>
        <GM-event name="Will it rain tomorrow ?">
            <description>Will there be 30 mm of rain tomorrow at Alenbi 283 st by 12:00 PM ?</description>
            <commission type="on-close">10</commission>
            <GM-options><GM-option>Yes</GM-option><GM-option>No</GM-option></GM-options>
            <GM-method><GM-LMSR><b>200</b></GM-LMSR></GM-method>
        </GM-event>
    </GM-events>
</Guess-Market>
